{
  "schema_version": "paper2-designed-source-manifest-v1",
  "geometry_version": "paper2-designed-corpus-geometry-v1",
  "ledger_version": "paper2-designed-source-candidate-ledger-v1",
  "ledger_sha256": "7e6ce72363251c312f2eeb72a4b52900f0158db535e47844e7a39254de55c194",
  "state": "ACTIVATED_MANIFEST_FROZEN",
  "activation_policy": {
    "start_rank": 1,
    "reserve_use_only_after_prefrozen_pre_claim_ir_failure": true,
    "coverage_driven_substitution_forbidden": true,
    "post_claim_ir_replacement_forbidden": true
  },
  "selection_outcome_blind": true,
  "claim_ir_consumed": false,
  "structural_signature_consumed": false,
  "phi_consumed": false,
  "entries": [
    {
      "slot_id": "MEM01",
      "surface": "primary",
      "sampling_stratum": "Memory",
      "challenge_pressure": null,
      "activated_rank": 1,
      "activation_outcome": "ACTIVATED_RANK_1",
      "replacement_reason": null,
      "stable_identity": {
        "kind": "DOI",
        "value": "10.1037/0033-295X.99.2.195"
      },
      "title": "Memory and the hippocampus",
      "year": 1992,
      "canonical_locator": "https://doi.org/10.1037/0033-295X.99.2.195",
      "registry_reference": "#23:5848069352",
      "source_access_class": "ABSTRACT_ONLY",
      "read_status": "ABSTRACT_ONLY_READ",
      "grounding_receipt": {
        "central_claim_supported": true,
        "limitation": "ABSTRACT_LEVEL_GROUNDING"
      },
      "author_lineage_key": "squire",
      "operational_tradition": "memory_system_dissociation",
      "relation_family": "constitutive_or_definitional",
      "coverage_claims": [
        "temporal_persistence_explicit",
        "acquisition_update_explicit",
        "resource_boundedness_not_required",
        "criterion_not_required",
        "partition_subsystem_explicit",
        "alternative_partition_material",
        "deterministic_exact"
      ]
    },
    {
      "slot_id": "MEM02",
      "surface": "primary",
      "sampling_stratum": "Memory",
      "challenge_pressure": null,
      "activated_rank": 1,
      "activation_outcome": "ACTIVATED_RANK_1",
      "replacement_reason": null,
      "stable_identity": {
        "kind": "DOI",
        "value": "10.1017/S0140525X01003922"
      },
      "title": "The magical number 4 in short-term memory",
      "year": 2001,
      "canonical_locator": "https://doi.org/10.1017/S0140525X01003922",
      "registry_reference": "#23:5848069602",
      "source_access_class": "ABSTRACT_ONLY",
      "read_status": "ABSTRACT_ONLY_READ",
      "grounding_receipt": {
        "central_claim_supported": true,
        "limitation": "ABSTRACT_LEVEL_GROUNDING"
      },
      "author_lineage_key": "cowan",
      "operational_tradition": "working_memory_capacity",
      "relation_family": "constraint_or_optimization",
      "coverage_claims": [
        "temporal_persistence_not_required",
        "acquisition_update_not_required",
        "resource_boundedness_explicit",
        "criterion_not_required",
        "probe_or_intervention_explicit",
        "stochastic_probabilistic_approximate"
      ]
    },
    {
      "slot_id": "MEM03",
      "surface": "primary",
      "sampling_stratum": "Memory",
      "challenge_pressure": null,
      "activated_rank": 1,
      "activation_outcome": "ACTIVATED_RANK_1",
      "replacement_reason": null,
      "stable_identity": {
        "kind": "DOI",
        "value": "10.1111/j.1467-9280.2006.01693.x"
      },
      "title": "Test-Enhanced Learning",
      "year": 2006,
      "canonical_locator": "https://doi.org/10.1111/j.1467-9280.2006.01693.x",
      "registry_reference": "#23:5848069805",
      "source_access_class": "ABSTRACT_ONLY",
      "read_status": "ABSTRACT_ONLY_READ",
      "grounding_receipt": {
        "central_claim_supported": true,
        "limitation": "ABSTRACT_LEVEL_GROUNDING"
      },
      "author_lineage_key": "roediger",
      "operational_tradition": "retrieval_practice",
      "relation_family": "intervention_sensitive_interaction",
      "coverage_claims": [
        "temporal_persistence_explicit",
        "acquisition_update_explicit",
        "resource_boundedness_not_required",
        "criterion_explicit",
        "probe_or_intervention_explicit",
        "stochastic_probabilistic_approximate"
      ]
    },
    {
      "slot_id": "MEM04",
      "surface": "primary",
      "sampling_stratum": "Memory",
      "challenge_pressure": null,
      "activated_rank": 1,
      "activation_outcome": "ACTIVATED_RANK_1",
      "replacement_reason": null,
      "stable_identity": {
        "kind": "DOI",
        "value": "10.1146/annurev.psych.53.100901.135114"
      },
      "title": "Episodic Memory: From Mind to Brain",
      "year": 2002,
      "canonical_locator": "https://doi.org/10.1146/annurev.psych.53.100901.135114",
      "registry_reference": "#23:5848070026",
      "source_access_class": "PARTIAL_TEXT",
      "read_status": "PARTIAL_TEXT_READ",
      "grounding_receipt": {
        "central_claim_supported": true,
        "limitation": "PARTIAL_PRIMARY_TEXT_GROUNDING"
      },
      "author_lineage_key": "tulving",
      "operational_tradition": "episodic_prospection",
      "relation_family": "constitutive_or_definitional",
      "coverage_claims": [
        "temporal_persistence_explicit",
        "acquisition_update_not_required",
        "resource_boundedness_not_required",
        "criterion_not_required",
        "partition_subsystem_explicit",
        "deterministic_exact"
      ]
    },
    {
      "slot_id": "MEM05",
      "surface": "primary",
      "sampling_stratum": "Memory",
      "challenge_pressure": null,
      "activated_rank": 1,
      "activation_outcome": "ACTIVATED_RANK_1",
      "replacement_reason": null,
      "stable_identity": {
        "kind": "DOI",
        "value": "10.1126/science.287.5451.248"
      },
      "title": "Memory—a century of consolidation",
      "year": 2000,
      "canonical_locator": "https://doi.org/10.1126/science.287.5451.248",
      "registry_reference": "#23:5848070270",
      "source_access_class": "ABSTRACT_ONLY",
      "read_status": "ABSTRACT_ONLY_READ",
      "grounding_receipt": {
        "central_claim_supported": true,
        "limitation": "ABSTRACT_LEVEL_GROUNDING"
      },
      "author_lineage_key": "mcgaugh",
      "operational_tradition": "consolidation",
      "relation_family": "causal_or_counterfactual",
      "coverage_claims": [
        "temporal_persistence_explicit",
        "acquisition_update_explicit",
        "resource_boundedness_not_required",
        "criterion_not_required"
      ]
    },
    {
      "slot_id": "MEM06",
      "surface": "primary",
      "sampling_stratum": "Memory",
      "challenge_pressure": null,
      "activated_rank": 1,
      "activation_outcome": "ACTIVATED_RANK_1",
      "replacement_reason": null,
      "stable_identity": {
        "kind": "DOI",
        "value": "10.1073/pnas.0803390105"
      },
      "title": "Visual long-term memory has a massive storage capacity for object details",
      "year": 2008,
      "canonical_locator": "https://doi.org/10.1073/pnas.0803390105",
      "registry_reference": "#23:5848070505",
      "source_access_class": "ABSTRACT_ONLY",
      "read_status": "ABSTRACT_ONLY_READ",
      "grounding_receipt": {
        "central_claim_supported": true,
        "limitation": "ABSTRACT_LEVEL_GROUNDING"
      },
      "author_lineage_key": "brady",
      "operational_tradition": "fidelity_distortion",
      "relation_family": "correlational_or_dependence",
      "coverage_claims": [
        "temporal_persistence_explicit",
        "acquisition_update_not_required",
        "resource_boundedness_not_required",
        "criterion_explicit",
        "probe_or_intervention_explicit",
        "stochastic_probabilistic_approximate"
      ]
    },
    {
      "slot_id": "LRN01",
      "surface": "primary",
      "sampling_stratum": "Learning",
      "challenge_pressure": null,
      "activated_rank": 1,
      "activation_outcome": "ACTIVATED_RANK_1",
      "replacement_reason": null,
      "stable_identity": {
        "kind": "DOI",
        "value": "10.1126/science.273.5280.1399"
      },
      "title": "A neostriatal habit learning system in humans",
      "year": 1996,
      "canonical_locator": "https://doi.org/10.1126/science.273.5280.1399",
      "registry_reference": "#23:5848106456",
      "source_access_class": "ABSTRACT_ONLY",
      "read_status": "ABSTRACT_ONLY_READ",
      "grounding_receipt": {
        "central_claim_supported": true,
        "limitation": "ABSTRACT_LEVEL_GROUNDING"
      },
      "author_lineage_key": "knowlton",
      "operational_tradition": "multiple_learning_systems",
      "relation_family": "correlational_or_dependence",
      "coverage_claims": [
        "temporal_persistence_not_required",
        "acquisition_update_explicit",
        "resource_boundedness_not_required",
        "criterion_explicit",
        "probe_or_intervention_explicit",
        "partition_subsystem_explicit",
        "stochastic_probabilistic_approximate"
      ]
    },
    {
      "slot_id": "LRN02",
      "surface": "primary",
      "sampling_stratum": "Learning",
      "challenge_pressure": null,
      "activated_rank": 1,
      "activation_outcome": "ACTIVATED_RANK_1",
      "replacement_reason": null,
      "stable_identity": {
        "kind": "DOI",
        "value": "10.1126/science.275.5306.1593"
      },
      "title": "A neural substrate of prediction and reward",
      "year": 1997,
      "canonical_locator": "https://doi.org/10.1126/science.275.5306.1593",
      "registry_reference": "#23:5848106688",
      "source_access_class": "ABSTRACT_ONLY",
      "read_status": "ABSTRACT_ONLY_READ",
      "grounding_receipt": {
        "central_claim_supported": true,
        "limitation": "ABSTRACT_LEVEL_GROUNDING"
      },
      "author_lineage_key": "schultz",
      "operational_tradition": "prediction_error_learning",
      "relation_family": "mapping_or_representation",